{
  "schema_version": 1,
  "confirmed": false,
  "source_root": "/Volumes/Archive Card",
  "import_plan": {
    "document": {
      "schema_version": 1,
      "plan_id": "plan-\"café\"",
      "created_at": {
        "unix_seconds": -1,
        "nanosecond": 0
      },
      "catalog": {
        "catalog_id": "catalog-雪",
        "manifests": []
      },
      "source": {
        "source_id": "source-card",
        "fingerprint": "41637c7875947b50775c0ab2bb30a28b292be748376a5713eb8f527d9953433c"
      },
      "items": [
        {
          "item_id": "item-1",
          "files": [
            {
              "source_file_id": "file-1",
              "source_path": [
                "DCIM",
                "café \"one\".jpg"
              ],
              "digest": "3b9c358f36f0a31b6ad3e14f309c7cf198ac9246e8316f9ce543d5b19ac02b80",
              "size_bytes": 1,
              "role": "primary"
            }
          ],
          "accepted_datetime": null,
          "disposition": {
            "kind": "excluded",
            "reason": "not selected\nline"
          }
        }
      ],
      "unhandled_content": [],
      "steps": [],
      "required_space_bytes": 0
    },
    "digest": "c9df6ebdc9a50f2b21ebcfa128bbc29586f36f2755f7609098e4b09f935ad9e3"
  }
}
